{
  "title": "Fixing a List Comprehension Bug",
  "learningObjective": "Identify and fix common list comprehension errors: off-by-one mistakes, incorrect conditions, and variable scope issues",
  "enablesNext": "You'll debug list comprehensions confidently and avoid these common pitfalls in your own code",
  "artifactContext": {
    "title": "Processing Student Grades",
    "description": "This function should filter students who passed (grade >= 60) and return their names in uppercase. A junior developer wrote this code but it's producing unexpected results.",
    "intendedBehavior": "Return uppercase names of students with grades 60 or above",
    "actualBehavior": "Returning students with grades above 60 (missing grade=60 students) and names are lowercase"
  },
  "artifact": {
    "type": "code",
    "language": "python",
    "filename": "grades.py",
    "buggyContent": "def get_passing_students(students):\n    \"\"\"Return uppercase names of passing students (grade >= 60)\"\"\"\n    \n    # Filter students with passing grades\n    passing = [s for s in students if s['grade'] > 60]\n    \n    # Get their names in uppercase  \n    names = [s['name'] for s in passing]\n    \n    return names\n\n# Test data\nstudents = [\n    {'name': 'Alice', 'grade': 85},\n    {'name': 'Bob', 'grade': 60},\n    {'name': 'Charlie', 'grade': 45},\n    {'name': 'Diana', 'grade': 72},\n]\n\nresult = get_passing_students(students)\nprint(result)",
    "correctContent": "def get_passing_students(students):\n    \"\"\"Return uppercase names of passing students (grade >= 60)\"\"\"\n    \n    # Filter students with passing grades\n    passing = [s for s in students if s['grade'] >= 60]\n    \n    # Get their names in uppercase  \n    names = [s['name'].upper() for s in passing]\n    \n    return names\n\n# Test data\nstudents = [\n    {'name': 'Alice', 'grade': 85},\n    {'name': 'Bob', 'grade': 60},\n    {'name': 'Charlie', 'grade': 45},\n    {'name': 'Diana', 'grade': 72},\n]\n\nresult = get_passing_students(students)\nprint(result)"
  },
  "errors": [
    {
      "id": "error-comparison",
      "lineStart": 5,
      "description": "Wrong comparison operator - excludes grade=60",
      "explanation": "Using '>' (greater than) instead of '>=' (greater than or equal) excludes students with exactly 60 points. Bob has grade=60 and should pass, but '60 > 60' is False.",
      "category": "logic",
      "severity": "error",
      "correctFix": "Change 's['grade'] > 60' to 's['grade'] >= 60'",
      "commonMistakes": [
        {
          "attempt": "s['grade'] > 59",
          "feedback": "This works but is less clear. Using >= 60 directly matches the requirement."
        }
      ]
    },
    {
      "id": "error-uppercase",
      "lineStart": 8,
      "description": "Missing .upper() call - names stay lowercase",
      "explanation": "The docstring says to return uppercase names, but we're just returning s['name'] without converting it. We need to call .upper() on the string.",
      "category": "semantic",
      "severity": "warning",
      "correctFix": "Change 's['name']' to 's['name'].upper()'",
      "commonMistakes": [
        {
          "attempt": "s['name'].uppercase()",
          "feedback": "Python strings don't have an uppercase() method. The correct method is upper()."
        },
        {
          "attempt": "str.upper(s['name'])",
          "feedback": "This works but is non-idiomatic. Prefer calling .upper() directly on the string."
        }
      ]
    }
  ],
  "steps": [
    {
      "id": "step-1-explain",
      "phase": "explain",
      "title": "Understanding the Problem",
      "instruction": "Read the code and look at the output. The function should return uppercase names of students with grade >= 60. But the output shows: ['Alice', 'Diana']. What's wrong?",
      "hints": [
        {
          "level": 1,
          "content": "Look at the test data: Bob has grade=60. Should Bob be in the results?"
        },
        {
          "level": 2,
          "content": "The docstring says 'grade >= 60' but look at line 5 - what comparison is actually being used?"
        }
      ],
      "requiresAction": false
    },
    {
      "id": "step-2-guided",
      "phase": "guided",
      "title": "Find the First Bug",
      "instruction": "Click on the issue that's causing Bob (grade=60) to be excluded from the results.",
      "hints": [
        {
          "level": 1,
          "content": "The bug is on the line where we filter for passing grades."
        },
        {
          "level": 2,
          "content": "Compare the comparison operator: > means 'greater than', >= means 'greater than or equal'. Which should we use?"
        },
        {
          "level": 3,
          "content": "Line 5 uses '> 60' but should use '>= 60' to include students with exactly 60."
        }
      ],
      "requiresAction": true,
      "mode": "identify",
      "expectedIdentifications": ["error-comparison"],
      "relevantErrors": ["error-comparison", "error-uppercase"]
    },
    {
      "id": "step-3-construct",
      "phase": "construct",
      "title": "Find and Fix All Issues",
      "instruction": "There's one more issue: the output shows lowercase names but should be uppercase. Find and fix both bugs.",
      "hints": [
        {
          "level": 1,
          "content": "Look at line 8 where we extract the names. How do we make strings uppercase in Python?"
        },
        {
          "level": 2,
          "content": "Python strings have a .upper() method. We need to call s['name'].upper()."
        }
      ],
      "requiresAction": true,
      "mode": "both",
      "relevantErrors": ["error-comparison", "error-uppercase"]
    },
    {
      "id": "step-4-outcome",
      "phase": "outcome",
      "title": "Verify the Fix",
      "instruction": "Compare the before and after code. With both bugs fixed, the output is now ['ALICE', 'BOB', 'DIANA'] - Bob is included, and all names are uppercase.",
      "hints": [
        {
          "level": 1,
          "content": "Notice how small changes (one character, one method call) can completely change the behavior."
        },
        {
          "level": 2,
          "content": "These are common bugs: off-by-one errors (> vs >=) and forgetting to apply transformations (.upper())."
        }
      ],
      "requiresAction": false,
      "showComparison": true
    }
  ],
  "outputPreview": {
    "buggyOutput": "['Alice', 'Diana']",
    "correctOutput": "['ALICE', 'BOB', 'DIANA']",
    "type": "text"
  },
  "realWorldImpact": "Off-by-one errors are among the most common bugs in programming. In a real system, this bug could cause students with exactly 60 points to fail when they should pass - affecting their academic record. Always pay attention to boundary conditions!",
  "completionMessage": "You've identified and fixed both bugs: the comparison operator (> to >=) and the missing .upper() call. These are extremely common mistakes - now you know to watch for them in your own code!"
}
